id,categoria,precio,precio_mxn,precio_usd,fecha_conversion,propiedad,metros_total,metros_construido,precio_m2_terreno,precio_m2_construido,tiempo_de_publicacion,dias_transcurridos,meses_transcurridos,fecha_mas_actual,tipo,Status,estacionamientos,recamaras,banos,medio_banos,bano_total,seguridad_privada,tipo_lugar,Colonia,Municipio,Estado,Colonia_Estandarizada,codigo_postal,ubicacion,url,descripcion
99,E2,675000,675000,33831,2024-11-05,DEPARTAMENTOEN VENTA EN COLONIAFRACCIONAMIENTO REAL NAVARRA FASE I,46,46,14673.91304347826,14673.91304347826,2024-08-13,0,0,2024-08-13,Departamento,Venta,1,2,1,0,1.0,No,,la argentina,tulancingo de bravo,hidalgo,la argentina,43628.0,"La Argentina, Tulancingo de Bravo, Hidalgo",https://www.lamudi.com.mx/detalle/41032-73-19bc7626f3da-2fad-1913597-957a-792f,"Empresa de intermediacion inmobiliaria. compraventa,renta, remodelacion, construcción y administración de inmuebles.La información aquí proporcionada puede ser sujeta a cambio sin previo aviso y muestran únicamente una propuesta y de ninguna forma puede ser considerada vinculante, contractual o de forma alguna obligación de cumplir con cierto ofrecimiento. Las imágenes y contenido pueden estar sujetas a derechos de autor, por lo que no se autoriza de ninguna forma su uso fuera de este sitio ni para fines distintos a los que fue publicado. Para mayor información se recomienda contactar con un asesor que le brinde atención personalizada."
100,E2,680000,680000,34082,2024-11-05,CASA ECONOMICA EN CAMPO ALEGRE TULANCINGO,90,46,7555.555555555556,14782.608695652174,2024-08-13,0,0,2024-08-13,Casa,Venta,2,2,1,0,1.0,No,,jaltepec,tulancingo de bravo,hidalgo,jaltepec,43700.0,"Jaltepec, Tulancingo de Bravo, Hidalgo",https://www.lamudi.com.mx/detalle/41032-73-cbb4b98fb7b8-56e-1912a13-8e08-7276,"La casa ubicada en campo alegre cuenta con todos los servicios, en la zona encontrarás tiendas, establecimientos de comida, parques y colegios.Es una zona tranquila, ideal para vivir con tu familia y ejercer tu crédito.La casa de 1 nivel cuenta con:Sala-comedor. Cocina 1 baño 2 recámaras. Patio de servicioCochera para un auto.Pregunta por la forma de pago.DISPONIBILIDAD Y PRECIO SUJETO A CAMBIOS Y/O VARIACIONES SIN PREVIO AVISO*El precio no incluye gastos de escrituración, gastos administrativos e impuestos. Horario de atención para citasLunes a viernes: 10:00 a 14:00 y 16:30 a 18:00Sábados: 10:00 a 14:30Domingos: previa citaMayores informes y citas: Ver teléfono Whatsapp ""HAY UN LUGAR ESPERANDO SER TU HOGAR"""
101,E2,730000,730000,36588,2024-11-05,"Casas económicas en Privada, Napateco Tulancingo Hgo.",91,53,8021.978021978022,13773.584905660377,2023-09-06,337,11,2024-08-13,Casa,Venta,2,2,1,0,1.0,No,,napateco,tulancingo de bravo,hidalgo,napateco,43629.0,"Napateco, Tulancingo de Bravo, Hidalgo",https://www.lamudi.com.mx/detalle/41032-73-61c2eecd4e32-58e5-84cdbd52-9055-4de0,"NUEVO DESARROLLO, PRIVADAS DE NAPATECO EN TULANCINGO HIDALGO.¡Es la mejor oportunidad para ejercer tu crédito, para desarrollar tus proyectos y/o tu patrimonio!Zona ubicada a 15 minutos de la Ciudad de Tulancingo, en una zona tranquila y acogedora para toda la familia. Tendrás la facilidad de servicios como, escuelas cerca desde primaria hasta universidad, farmacias, hospitales, tiendas de autoservicio, gasolinera y todo tipo de comercio de primera necesidad. Las casas cuenta con: Sala.Comedor.Cocina con barra.2 recámaras.   1 baño completo. Patio de servicio.  Estacionamiento para 1 auto.Incluyen:Servicios ocultos.Calles de concreto (20 cm de grosor). Pregunta por la forma de pago.DISPONIBILIDAD Y PRECIO SUJETO A CAMBIOS Y/O VARIACIONES SIN PREVIO AVISO*El precio no incluye gastos de escrituración, gastos administrativos e impuestos. Horario de atención para citasLunes a viernes: 10:00 a 14:00 y 16:30 a 18:00Sábados: 10:00 a 14:30Domingos: previa citaMayores informes y citas: Ver teléfono Whatsapp ""HAY UN LUGAR ESPERANDO SER TU HOGAR"""
102,E2,670000,670000,33581,2024-11-05,PREVENTA Departamentos nuevos y económicos en Tulancingo,60,60,11166.666666666666,11166.666666666666,2023-04-20,479,15,2024-08-13,Departamento,Venta,1,2,1,0,1.0,No,,los pinos,tulancingo de bravo,hidalgo,los pinos,43612.0,"Los Pinos, Tulancingo de Bravo, Hidalgo",https://www.lamudi.com.mx/detalle/41032-73-2bd215798759-6b9b-c4a4aff1-b239-3fed,"Oportunidad de Departamentos nuevos y económicos en Col Nuevo Tulancingo; una zona con alta plusvalía, ubicados a un costado de la nueva clinica del IMSS, ideales para una inversión segura, a solo 3 min de la Central de autobuses, Plaza del Vestido la cual es una zona de gran comercio principalmente los días jueves. A 5 minutos de Bodega Aurrera y del centro de la Ciudad, distintas vías de acceso, 15 minutos del famoso balneario de Santa Ana de aguas termales.El fraccionamiento es un complejo de 6 edificios, con barda perimetral, accesos controlados, calles de concreto hidraulico, transporte publico en la entrada principal, pequeña área comercial en el interior del mismo y áreas verdes.Los departamentos cuentan con:2 recámaras.Sala.Comedor.Cocina.Área de lavado.Área de tendido.1 baño.1 cajon de estacionamiento.PRECIO DE PREVENTA DESDE $670,000Torre 051er. piso (planta baja) $700 mil Baja2do. piso $690,000.003er. piso $680,000.004to. piso $670,000.00Con plan de financiamiento a 18 Meses Sin Intereses.Entrega completamente terminado: Diciembre 2024 - Enero 2025 Pregunta por la forma de pago.DISPONIBILIDAD Y PRECIO SUJETO A CAMBIOS Y/O VARIACIONES SIN PREVIO AVISO*El precio publicado corresponde a la propiedad, NO incluye gastos de escrituración u otros conceptos. *El tiempo estimado de entrega puede cambiar según los tiempo de construcción y obra**El precio no incluye gastos de escrituración, gastos administrativos e impuestos. Horario de atención para citasLunes a viernes: 10:00 a 14:00 y 16:30 a 18:00Sábados: 10:00 a 14:30Domingos: previa citaMayores informes y citas: Ver teléfono Whatsapp ""HAY UN LUGAR ESPERANDO SER TU HOGAR"""
103,D1,1150000,1150000,57638,2024-11-05,"CASA NUEVA EN PRIVADA SAN DANIEL, TULANCINGO HIDALGO",105,62,10952.380952380952,18548.3870967742,2023-04-20,479,15,2024-08-13,Casa,Venta,2,2,1,0,1.0,No,,rojo gomez,tulancingo de bravo,hidalgo,rojo gomez,43645.0,"Rojo Gómez, Tulancingo de Bravo, Hidalgo",https://www.lamudi.com.mx/detalle/41032-73-e1e9f2183ac5-7f02-5ba171a0-bd32-34c5,"CASA EN PRIVADA SAN DANIEL Casa ubicada en Privada San Daniel muy cerca de la Unidad Deportiva, excelente ubicación a 10 min del centro de Tulancingo y a 5 min de la central de abastos. La zona cuenta con escuelas públicas y privadas (de educación básica, media, media superior y superior), parques cerca, gasolineras, tiendas de auto servicio, etc...  La casa cuenta con:-2 recámaras. -Sala.- Comedor. -Cocina.- 1 baño. -Área de lavado. -Cochera para un vehículo.-Cisterna. -Construcción nueva.   Pregunta por la forma de pago. DISPONIBILIDAD Y PRECIO SUJETO A CAMBIOS Y/O VARIACIONES SIN PREVIO AVISO*El precio no incluye gastos de escrituración, gastos administrativos e impuestos. Horario de atención para citasLunes a viernes: 10:00 a 14:00 y 16:30 a 18:00Sábados: 10:00 a 14:30Domingos: previa citaMayores informes y citas: Ver teléfono Whatsapp ""HAY UN LUGAR ESPERANDO SER TU HOGAR"""
104,E3,945000,945000,47364,2024-11-05,CASA ECONOMICA NUEVA INDIGO EN FRACCIONAMIENTO RESIDENCIAL TULANCINGO,66,66,14318.181818181818,14318.181818181818,2024-08-13,0,0,2024-08-13,Casa,Venta,2,2,1,1,1.5,No,,valle verde,tulancingo de bravo,hidalgo,valle verde,43648.0,"Valle Verde, Tulancingo de Bravo, Hidalgo",https://www.lamudi.com.mx/detalle/41032-73-fad01c1a75f1-e779-190e105-886d-7aea,"Fracc. Residencial Rancho Santa clara se encuentra en Valle Verdel, la cual es una zona inigualable, a unos pasos de mega comercial mexicana, plaza patio (centros comerciales, bancos, pizzería, cine, centros de reunión),y a 10 minutos del centro de la ciudad.El Fraccionamiento te ofrece una casa de dos niveles exclusiva, lujosa y amplia  con las siguientes características: -Planta baja:CocinaSalaComedorMedio bañoEstacionamientoPatio de servicioÁrea de guardado y jardín-Planta alta:Pasillo2 Recámaras1 Baño Pregunta por la forma de pago. DISPONIBILIDAD Y PRECIO SUJETO A CAMBIOS Y/O VARIACIONES SIN PREVIO AVISO*El precio no incluye gastos de escrituración, gastos administrativos e impuestos. Horario de atención para citasLunes a viernes: 10:00 a 14:00 y 16:30 a 18:00Sábados: 10:00 a 14:30Domingos: previa citaMayores informes y citas: Ver teléfono Whatsapp ""HAY UN LUGAR ESPERANDO SER TU HOGAR"""
105,E3,790000,790000,39595,2024-11-05,"Casa en Fracc. Los Arcos, Napateco Tulancingo de Bravo Hidalgo",92,69,8586.95652173913,11449.27536231884,2024-08-13,0,0,2024-08-13,Casa,Venta,2,2,1,0,1.0,No,,cebolletas,tulancingo de bravo,hidalgo,san nicolas cebolletas (cebolletas),43710.0,"Cebolletas, Tulancingo de Bravo, Hidalgo",https://www.lamudi.com.mx/detalle/41032-73-2436b19a63d0-3842-1912485-8d91-7e20,"Casa en venta en Napateco, Fraccionamiento ""Los Arcos"".La colonia cuenta con todos los servicios, en la zona encontrarás tiendas, establecimientos de comida, farmacias, Oxxo, gasolinera, espacios para realizar ejercicio al aire libre, parque para los pequeños de tu hogar, canchas para practicar algún deporte, guarderías, escuelas de nivel básico, universidad a solo 10 minutos de la colonia. El centro de Tulancingo está a solo 15 minutos de Napateco, cuenta con transporte directo a la colonia.La casa de 1 nivel cuenta con:Sala-comedor. Cocina con barra.1 baño completo forrado de azulejo. 2 recámaras. Patio de servicio con protección en techo.Cochera para un auto.Amenidades: Construcción tradicional. Cimentación de piedra.Tabique.Losa maciza.Pregunta por la forma de pago.DISPONIBILIDAD Y PRECIO SUJETO A CAMBIOS Y/O VARIACIONES SIN PREVIO AVISO*El precio no incluye gastos de escrituración, gastos administrativos e impuestos. Horario de atención para citasLunes a viernes: 10:00 a 14:00 y 16:30 a 18:00Sábados: 10:00 a 14:30Domingos: previa citaMayores informes y citas: Ver teléfono Whatsapp ""HAY UN LUGAR ESPERANDO SER TU HOGAR"""
106,E3,980000,980000,49118,2024-11-05,"CASA EN PROMOCION $980,000 solo pago de contado",105,70,9333.333333333334,14000.0,2024-07-04,39,1,2024-08-13,Casa,Venta,2,2,1,0,1.0,No,,insurgentes,tulancingo de bravo,hidalgo,insurgentes,43630.0,"Insurgentes, Tulancingo de Bravo, Hidalgo",https://www.lamudi.com.mx/detalle/41032-73-4fc03eec26cc-664b-59212c90-b8a7-4ffa,"Villas Santa María es un nuevo fraccionamiento que tiene la ubicación exacta para personas que vienen de CDMX, Pachuca o aquellos que buscan salir rápido de la ciudad u ocupan viajar sobre la carretera México-Tuxpan continuamente. Ideal para familias pequeñas que comienzan su patrimonio o que buscan un espacio más acogedor, la seguridad y tranquilidad la tendrás en este, ¡tú nuevo hogar!. Cuenta con todos los servicios, establecimientos de primera necesidad a los alrededores, farmacias, transporte público cercano, escuelas desde nivel básico hasta superior (Universidad Técnológica de Tulancingo), a solo 10 minutos del centro de Tulancingo.  La casa cuenta con:Sala.Comedor.Cocina .1 baño.2 recámaras.Cochera para 1 auto.Área de lavado.           Pregunta por la forma de pago DISPONIBILIDAD Y PRECIO SUJETO A CAMBIOS Y/O VARIACIONES SIN PREVIO AVISO*El precio no incluye gastos de escrituración, gastos administrativos e impuestos.  Horario de atención para citasLunes a viernes: 10:00 a 14:00 y 16:30 a 18:00Sábados: 10:00 a 14:30Domingos: previa citaMayores informes y citas: Ver teléfono Whatsapp ""HAY UN LUGAR ESPERANDO SER TU HOGAR"""
107,D1,1050000,1050000,52626,2024-11-05,"CASA DE 1 NIVEL EN PRIVADA, TULANCINGO HIDALGO",105,70,10000.0,15000.0,2024-03-02,161,5,2024-08-13,Casa,Venta,2,2,1,0,1.0,No,,rojo gomez,tulancingo de bravo,hidalgo,rojo gomez,43645.0,"Rojo Gómez, Tulancingo de Bravo, Hidalgo",https://www.lamudi.com.mx/detalle/41032-73-58b55adc017b-6914-f7d09bf-9a71-458e,"Villas Santa María es un nuevo fraccionamiento que tiene la ubicación exacta para personas que vienen de CDMX, Pachuca o aquellos que buscan salir rápido de la ciudad u ocupan viajar sobre la carretera México-Tuxpan continuamente. Ideal para familias pequeñas que comienzan su patrimonio o que buscan un espacio más acogedor, la seguridad y tranquilidad la tendrás en este, ¡tú nuevo hogar!.  Cuenta con todos los servicios, establecimientos de primera necesidad a los alrededores, farmacias, transporte público cercano, escuelas desde nivel básico hasta superior (Universidad Técnológica de Tulancingo), a solo 10 minutos del centro de Tulancingo. La casa cuenta con:Sala.Comedor.Cocina .1 baño.2 recámaras.Cochera para 1 auto.Área de lavado.Pregunta por la forma de pago.DISPONIBILIDAD Y PRECIO SUJETO A CAMBIOS Y/O VARIACIONES SIN PREVIO AVISO*El precio no incluye gastos de escrituración, gastos administrativos e impuestos. Horario de atención para citasLunes a viernes: 10:00 a 14:00 y 16:30 a 18:00Sábados: 10:00 a 14:30Domingos: previa citaMayores informes y citas: Ver teléfono Whatsapp ""HAY UN LUGAR ESPERANDO SER TU HOGAR"""
108,D1,1060000,1060000,53128,2024-11-05,CASA NUEVA EN FRACC. TOLEDO TULANCINGO,105,71,10095.238095238095,14929.577464788732,2024-08-13,0,0,2024-08-13,Casa,Venta,2,2,1,0,1.0,No,,rojo gomez,tulancingo de bravo,hidalgo,rojo gomez,43645.0,"Rojo Gómez, Tulancingo de Bravo, Hidalgo",https://www.lamudi.com.mx/detalle/41032-73-ff9517ed2d02-801-19138a5-917a-759a,"La casa se encuentra en Fracc. Toledo ubicado a 15 minutos de la Ciudad de Tulancingo, en una zona tranquila y acogedora para toda la familia, cuenta con todos los servicios (agua, luz, drenaje)Tendrás la facilidad de encontrar escuelas cercanas, tiendas de autoservicio, tienda 3B, tiendas para articulos del hogar, transporte publico y  zonas de areas verdes.La casa de un nivel cuenta con: Sala.Comedor.Cocina 2 recámaras.   1 baño completo. Patio de servicio.  Estacionamiento para 1 auto.Pregunta por la forma de pago. DISPONIBILIDAD Y PRECIO SUJETO A CAMBIOS Y/O VARIACIONES SIN PREVIO AVISO*El precio no incluye gastos de escrituración, gastos administrativos e impuestos. Horario de atención para citasLunes a viernes: 10:00 a 14:00 y 16:30 a 18:00Sábados: 10:00 a 14:30Domingos: previa citaMayores informes y citas: Ver teléfono Whatsapp ""HAY UN LUGAR ESPERANDO SER TU HOGAR"""
109,D1,1080000,1080000,54130,2024-11-05,"Casa con opción de crecimiento en Villas Santa María, Tulancingo Hgo.",105,73,10285.714285714286,14794.520547945203,2023-12-15,239,7,2024-08-13,Casa,Venta,2,2,1,0,1.0,No,,rojo gomez,tulancingo de bravo,hidalgo,rojo gomez,43645.0,"Rojo Gómez, Tulancingo de Bravo, Hidalgo",https://www.lamudi.com.mx/detalle/41032-73-148a066ebd7c-a22f-24777fa3-acc5-46bd,"Fraccionamiento Villas Santa María ubicado en una zona con accesos a CDMX y Pachuca, muy cerca de la carretera México-Tuxpan. Ideal para familias que comienzan su patrimonio o que buscan un espacio más acogedor, con seguridad y tranquilidad. El Fraccionamiento cuenta con: barda perimetral, caseta de vigilancia, áreas verdes, juegos y aparatos de ejercicio al aire libre, calles de concreto, servicios ocultos, casas con muros independientes, cimientos de piedra, está proyectado para tener su propia area comercial y se cuenta con un reglamento interno para una sana convivencia.La zona cuenta con todos los servicios, establecimientos de primera necesidad a los alrededores, transporte público cercano, escuelas desde nivel básico hasta superior (Universidad Técnológica de Tulancingo), a solo 10 minutos del centro de Tulancingo, a 5 minutos de Plaza Patio. La casa cuenta con:2 recámaras con closet.1 alcoba.Sala-comedor.Cocina integral con barra desayunadora.1 baño forrado de azulejo.Cochera.Área de lavado.Cisterna con bomba de 2,500 litros.Tinaco de 1,100 litros.Con opción de crecimiento!!Pregunta por la forma de pago.DISPONIBILIDAD Y PRECIO SUJETO A CAMBIOS Y/O VARIACIONES SIN PREVIO AVISO*El precio no incluye gastos de escrituración, gastos administrativos e impuestos. Horario de atención para citasLunes a viernes: 10:00 a 14:00 y 16:30 a 18:00Sábados: 10:00 a 14:30Domingos: previa citaMayores informes y citas: Ver teléfono Whatsapp ""HAY UN LUGAR ESPERANDO SER TU HOGAR"""
110,E3,950000,950000,47614,2024-11-05,CASA EN MAGISTERIO BIENVENIDOS CRÉDITOS HIPOTECARIOS,92,77,10326.08695652174,12337.662337662336,2024-07-06,37,1,2024-08-13,Casa,Venta,2,2,1,0,1.0,No,,rojo gomez,tulancingo de bravo,hidalgo,rojo gomez,43645.0,"Rojo Gómez, Tulancingo de Bravo, Hidalgo",https://www.lamudi.com.mx/detalle/41032-73-82e8557da084-6bc3-2f8760c4-a055-4cf3,"La casa se encuentra lista para habitar con  documentos en regla. Esta ubicada en Magisterio 2, la zona es tranquila, con acceso a todos los servicios, transporte público, cerca de escuelas públicas y privadas, a 10 min del centro de Tulancingo, a pocos metros de la carretera federal y autopista México-Tuxpan y Pachuca-Tulancingo.La casa de una planta cuenta con:Sala-ComedorCocina2 Recamaras1 BañoPatio de servicioAmenidades:Pisos interceramicConstrucción tradicional Cimientos y losa maciza Pregunta por la forma de pago.DISPONIBILIDAD Y PRECIO SUJETO A CAMBIOS Y/O VARIACIONES SIN PREVIO AVISO*El precio no incluye gastos de escrituración, gastos administrativos e impuestos. Horario de atención para citasLunes a viernes: 10:00 a 14:00 y 16:30 a 18:00Sábados: 10:00 a 14:30Domingos: previa citaMayores informes y citas: Ver teléfono Whatsapp ""HAY UN LUGAR ESPERANDO SER TU HOGAR"""
111,D1,1050000,1050000,52626,2024-11-05,"CASA EN FRACCIONAMIENTO CERRADO, CIMA DORADA TULANCINGO",105,77,10000.0,13636.363636363636,2023-12-15,239,7,2024-08-13,Casa,Venta,2,2,1,0,1.0,No,,san jose caltengo,tulancingo de bravo,hidalgo,san jose caltengo,43628.0,"San Jose Caltengo, Tulancingo de Bravo, Hidalgo",https://www.lamudi.com.mx/detalle/41032-73-60f9fc9ca4df-8fdf-6c7094aa-a826-4471,"El fraccionamiento Cima Dorada cuenta con 2 acceso con caseta de vigilancia, pista para caminatas, área de asadores, cancha de basquetbol y área de juegos para niños.Ubicado a tan solo 5 minutos del centro de la cuidad, a un costado de la zona Arqueológica de Huapalcalco, muy cerca de clínicas médicas, hospitales, escuelas, establecimientos comerciales, central de autobuses, transporte público a una cuadra. La casa cuenta con:Sala-comedor.Cocina con tarja.1 baño completo.2 recámaras amplias.Patio de servicio.Cochera para 1 vehículos.Jardín interior artificial con acceso por sala comedor.AMENIDADES:Cisterna de 3,300 litrosTanque estacionario.Calentador de gas. Tinaco de 1,100 litros.Bomba de agua. Luminarias LED. Pregunta por la forma de pago.DISPONIBILIDAD Y PRECIO SUJETO A CAMBIOS Y/O VARIACIONES SIN PREVIO AVISO*El precio no incluye gastos de escrituración, gastos administrativos e impuestos. Horario de atención para citasLunes a viernes: 10:00 a 14:00 y 16:30 a 18:00Sábados: 10:00 a 14:30Domingos: previa citaMayores informes y citas: Ver teléfono Whatsapp ""HAY UN LUGAR ESPERANDO SER TU HOGAR"""
112,E3,995000,995000,49870,2024-11-05,VENTA DE CASA DE LUJO EN TULANCINGO,95,78,10473.684210526317,12756.410256410256,2024-08-13,0,0,2024-08-13,Casa,Venta,2,2,1,0,1.0,No,,insurgentes,tulancingo de bravo,hidalgo,insurgentes,43630.0,"Insurgentes, Tulancingo de Bravo, Hidalgo",https://www.lamudi.com.mx/detalle/41032-73-69ef91f1fe62-dfa7-190f7d1-aa95-734d,"VENTA DE CASA 🏠 EN MAGISTERIO 2 cuenta con:-95 m2 de terreno -78 de construcción - sala - ⁠comedor- ⁠cocina - ⁠2 recámaras- ⁠cochera para 1 auto - ⁠patio de servicio - ⁠1 baño completo La construcción es tradicional,    • cimientos de piedra    • muros de tabique rojo recocido    • losas macizas. Costo 💲 995,000.000 Cercania con mega Soriana Centros comerciales, bancos, farmacias y hospitales. Cercanía con la Universidad Tecnológica de Tulancingo Aceptamos cualquier tipo de crédito"
113,E2,650000,650000,32578,2024-11-05,"VENTA DE CASA ECONÓMICA EN NAPATECO, EN TULANCINGO HIDALGO",90,90,7222.222222222223,7222.222222222223,2024-02-28,166,5,2024-08-13,Casa,Venta,2,2,1,0,1.0,No,,cebolletas,tulancingo de bravo,hidalgo,san nicolas cebolletas (cebolletas),43710.0,"Cebolletas, Tulancingo de Bravo, Hidalgo",https://www.lamudi.com.mx/detalle/41032-73-41ce0348aadc-9c56-96819439-86d4-1f2c,"Venta de casa en HACIENDAS DE NAPATECOPRECIO 590 MIL 2 RECAMARASSALACOMEDORCOCINA JARDIN ESTACIONAMIENTOPATIO DE SERVICIOTerreno: 90 metros cuadradosConstrucción: 50 metros cuadrados Cercanía con escuelas, centros deportivos, OXXO, tiendas 3 B. Cuenta con todos los servicios, agua, luz, drenaje pavimento telefonía internet.A 10 minutos de la Universidad PolitécnicaA tan solo 15 minutos de TulancingoA 10 minutos de la terminal de autobuses. ACEPTO CRÉDITOS INFONAVIT FOVISSSTE ISSFAM IMSS BANCARIOS PAGOS DE CONTADOAsesoria inmobiliaria y jurídica GRATISCel.Ver teléfono WhatsappContactar"
114,E3,870000,870000,43605,2024-11-05,VENTA DE CASA EN VISITA REAL FRACCIONAMIENTO PRIVADO EN TULANCINGO COCINA DE REGALO,90,90,9666.666666666666,9666.666666666666,2024-07-01,42,1,2024-08-13,Casa,Venta,2,2,1,0,1.0,No,,san juan,tulancingo de bravo,hidalgo,san juan,43685.0,"San Juan, Tulancingo de Bravo, Hidalgo",https://www.lamudi.com.mx/detalle/41032-73-4bb525b20b32-56ca-1906c25-a0d5-77b7,"VENTA DE CASA EN FRACCIONAMIENTO PRIVADO EN VISTA REAL Cercania a la presidencia municipal de Tulancingo A tan solo 10 minutos del centro de Tulancingo y a 3 minutos del centro de Jaltepeccercania con la Expoferia TULANCINGO Frente al Conalep de JaltepecCercania a Restaurantes, farmacias, escuelas de nivele básico. Acceso vías de comunicación, carretera México, Tuxpan y Tulancingo Pachuca.2 RECAMARAS SALA COMEDOR COCINA JARDIN ESTACIONAMIENTO PATIO DE SERVICIO INCLUYE COCINA INTEGRAL A UN SUPER PRECIO ACEPTO CRÉDITOS INFONAVIT FOVISSSTE ISSFAM IMSS CFE BANCARIOS Contactar"
115,E3,980000,980000,49118,2024-11-05,VENTA DE CASA ECONOMICA EN ESQUINA CON LOCAL,90,90,10888.888888888889,10888.888888888889,2024-07-14,30,0,2024-08-13,Casa,Venta,2,2,1,0,1.0,No,,jaltepec,tulancingo de bravo,hidalgo,jaltepec,43700.0,"Jaltepec, Tulancingo de Bravo, Hidalgo",https://www.lamudi.com.mx/detalle/41032-73-cc355a63c8df-bd23-190afcd-b7cc-7ed8,"VENTA DE CASA EN JALTEPEC (CAMPO ALEGRE )2RECAMARAS SALA COMEDOR COCINA ESTACIONAMIENTO PATIO DE SERVICIO 2A. PLANTA YA SE INICIO PARA  AMPLIAR EL SEGUNDO PISO INCLUYE, PROTECCIONES, ZAGUÁN, MARQUESINA Y BARDAS ALTAS. ACEPTO CRÉDITOS INFONAVIT FOVISSSTE ISSFAM IMSS CFE BANCARIOS PAGOS DE CONTADO CERCANIA CON EL CONALEPCERCANIA A ESCUELAS EE EDUCACIÓN BÁSICA CERCA DE TULANCINGO Y JALTEPEC Contactar"
116,E2,549000,549000,27516,2024-11-05,"Casa VENTA, Guadalupe 1a Sección, Tulancingo de Bravo, Hidalgo",140,100,3921.428571428572,5490.0,2024-06-13,60,2,2024-08-13,Casa,Venta,2,2,1,1,1.5,No,,francisco i madero,tulancingo de bravo,hidalgo,francisco i. madero,43650.0,"Francisco I Madero, Tulancingo de Bravo, Hidalgo",https://www.lamudi.com.mx/detalle/41032-73-a8461c0ca6da-78da-deaa8761-a81b-49c0,"Casa VENTA, Guadalupe 1a Sección, Tulancingo de Bravo, HidalgoEHL ID AF13838Casa de RECUPERACIÓN HIPOTECARIA, gran oportunidad para invertir en Guadalupe 1ª Sección, Tulancingo de Bravo, HidalgoSomos uno de los despachos con más experiencia del país y te acompañaremos en todo el proceso.Solamente CONTADO / NO CRÉDITOS. • Firma frente a Notario Público • La vivienda sólo se puede ver por fuera¿Te interesa? Llámanos al Ver teléfono Whatsapp o escríbenos al correo: Contactar PRECIOS Y DISPONIBILIDAD SUJETOS A CAMBIOS SIN PREVIO AVISO. *LOS DETALLES DEL INMUEBLE SON APROXIMADOS.Condición construcción: MediaUso de suelo: ResidencialMétodo de pago: ContadoClave interna: EHL ID AF13838"
117,E3,841000,841000,42151,2024-11-05,"Invierte con confianza, Casa en Venta, Vicente Guerrero, Tulancingo",110,110,7645.454545454545,7645.454545454545,2024-07-09,34,1,2024-08-13,Casa,Venta,2,2,1,1,1.5,No,,vicente guerrero,tulancingo de bravo,hidalgo,vicente guerrero,43630.0,"Vicente Guerrero, Tulancingo de Bravo, Hidalgo",https://www.lamudi.com.mx/detalle/41032-73-db0b45b5cc0e-8c9-75fa1f48-8987-4ede,GRUPO INMOBILIARIA GACAVA¿Te ha pasado que cuando encuentras la casa perfecta está por encima de tu presupuesto?Tú casa ideal no tiene que ser un sueño inalcanzable.Permíteme ayudarte a obtener el lugar ideal para ti y tu familia.Contáctame y te platico cómo puedes lograrlo.
118,E3,841000,841000,42151,2024-11-05,"CASA en Venta en Col. Vicente Guerrero, Centro de Tulancingo, Hgo.",110,110,7645.454545454545,7645.454545454545,2024-07-03,40,1,2024-08-13,Casa,Venta,2,2,1,1,1.5,No,,vicente guerrero,tulancingo de bravo,hidalgo,vicente guerrero,43630.0,"Vicente Guerrero, Tulancingo de Bravo, Hidalgo",https://www.lamudi.com.mx/detalle/41032-73-16cb3becc27a-c164-5cc298ad-8bde-40c9,"¡GRAN OPORTUNIDAD DE TENER TU CASA PROPIA!Ideal para parejas que comienzan su vida juntos, dentro de un entorno tranquilo y céntrico, cerca de avenidas, parques, plazas, escuelas y comercios.Adquiere este inmueble a un excelente precio y con una inversión inicial de: $290,000 pesos. Si requieres más información y es de tu interés contáctame y a la brevedad me comunico contigo."
